External_Id__c,Owner.External_Id__c,Account.External_Id__c,Subject,Description,Status_Options,First_Contact_Close__c,CreatedDate__c,Status,Product_Family_KB__c,CSAT__c,Origin,Priority,Reason,Type_of_Support__c,Milestone_Status__c,BusinessHours.Name
W_Case.87,W_User.8,W_Account.27,Incorrect bill,By bill is displaying incorrect information.  I was billed double last month.  Please help with this stat!,Closed,FALSE,2016-11-30 03:48:35,Closed,Consumer,82,Phone,Low,Hardware Issue,Standard,Closed - Compliant,Australia and New Zealand
W_Case.88,W_User.3,W_Account.20,Billing statement reprint,I've managed to lose my most recent billing statement from you.  Would you mind sending me a reprint?  That would really help me out.  Thank you!,Working,FALSE,2017-03-13 04:56:38,Working,Projectors,0,Website,High,Documentation Issue,Standard,Open - Compliant,24/7 Follow-The-Sun Service
W_Case.89,W_User.1,W_Account.23,How do I get started with your service?,"Now that I've signed up, what do I do next?",Working,FALSE,2016-02-15 10:37:35,Working,Consumer,0,Website,High,Feature Request,Standard,Open - Compliant,Asia
W_Case.90,W_User.15,W_Account.48,Product is shutting down intermittently,The product is shutting down periodically. It does not seem to be related to overheating.,Attention,FALSE,2016-11-13 20:24:02,Attention,Hotspot Services,0,Phone,Medium,Feature Request,Standard,Open - Compliant,Australia and New Zealand
W_Case.91,W_User.20,W_Account.25,How do I get started with your service?,"Now that I've signed up, what do I do next?",Escalated,FALSE,2016-02-11 16:50:13,Escalated,Hotspot Services,0,Phone,High,Existing problem,Premium,Open - Compliant,24/7 Follow-The-Sun Service
W_Case.92,W_User.20,W_Account.72,Product setup issues,"I recently received your product, but I'm having a little trouble getting started.  Would you be able to help me?  Thank you.",Working,FALSE,2016-02-19 20:30:57,Working,Enterprise,0,Twitter,Medium,Problem Resolved,Standard,Open - Compliant,24/7 Follow-The-Sun Service
W_Case.93,W_User.13,W_Account.67,What's included in your service contract?,Do I need a service contract? Where can I find out what's covered and what's not?,Working,FALSE,2016-11-22 10:31:45,Working,Conferencing,0,Phone,Critical,New problem,Standard,Open - Compliant,Asia
W_Case.94,W_User.8,W_Account.46,How do I change my communication preferences?,I'd like to switch from regular mail to email.  How do I do this?,On Hold,FALSE,2016-01-24 00:08:17,On Hold,Home Theatre,0,Mobile Device,Critical,Software Issue,Standard,Open - Compliant,24/7 Follow-The-Sun Service
W_Case.95,W_User.7,W_Account.55,Can I access your community from my mobile device?,"If I want to participate in your community from the road, can I do it from my mobile device?",New,TRUE,2016-05-14 09:31:14,New,Hotspot Services,0,Q&A,Medium,Feature Request,Standard,Open - Compliant,24/7 Follow-The-Sun Service
W_Case.96,W_User.8,W_Account.67,Product is shutting down intermittently,The product is shutting down periodically. It does not seem to be related to overheating.,Working,FALSE,2016-08-03 22:07:21,Working,Speakers,0,Email,High,Problem Resolved,Standard,Open - Compliant,North America
W_Case.97,W_User.15,W_Account.65,How do I become a partner?,I'm interested in becoming one of your partners.  How do I go about doing this?,Working,FALSE,2016-07-28 14:31:04,Working,Conferencing,0,Facebook,Low,Mail delivery issue,Standard,Open - Compliant,Australia and New Zealand
W_Case.98,W_User.16,W_Account.39,Shipping container appears damaged,"When your product arrived, the box was damaged, and I'm not certain if your product is working properly.  What's the return process?",Closed in Community,FALSE,2016-03-26 12:32:08,Closed in Community,Consumer,75,Website,Low,Problem Resolved,Premium,Closed - Compliant,Asia
W_Case.99,W_User.10,W_Account.70,Need guidance getting started with my installation,I need some help getting started with this installation.,Attention,FALSE,2016-10-29 22:12:37,Attention,Conferencing,0,Email,Medium,Feature Request,Standard,Open - Compliant,Europe and the Middle East
W_Case.100,W_User.6,W_Account.56,What does your service contract cover?,I'm deciding if I need a service contract for your products.  Where can I find out what's covered and what's not?,Attention,FALSE,2016-05-26 22:16:41,Attention,Home Theatre,0,Facebook,Low,Problem Resolved,Standard,Open - Compliant,Asia
W_Case.101,W_User.19,W_Account.70,Was our last payment correct?,Our records indicate that we may have underpaid for our last order.  Can you please send a copy of our invoice?,Working,FALSE,2016-01-02 09:51:52,Working,Hotspot Services,0,Phone,Low,New problem,Standard,Open - Compliant,North America
W_Case.102,W_User.16,W_Account.53,How do I set up auto-payment?,I'd like to set up automatic payments rather than having to remember each time.  How do I go about doing this?,New,FALSE,2016-01-16 04:32:28,New,Hotspot Services,0,Phone,Medium,Hardware Issue,Standard,Open - Violation,Asia
W_Case.103,W_User.11,W_Account.16,I need to pay my invoice.,It looks like I accidentally forgot to pay my invoice this month.  What's the quickest way to do this?,Closed,TRUE,2017-03-04 00:32:03,Closed,Enterprise,54,Phone,Low,New problem,Premium,Closed - Compliant,Asia
W_Case.104,W_User.18,W_Account.68,Bill payment clarification.,"I seem to have misplaced my last bill, and I want to be sure that it's paid. Can you please check this for me?",On Hold,TRUE,2017-01-29 11:20:33,On Hold,Home Theatre,0,Twitter,Low,Mail delivery issue,Standard,Open - Compliant,Europe and the Middle East
W_Case.105,W_User.6,W_Account.56,Troubleshooting issues with the product,I think the product I have is malfunctioning. Do I need an update or upgrade? What should I do?,Escalated,FALSE,2016-04-16 06:39:52,Escalated,Hotspot Services,0,Email,Low,Problem Resolved,Standard,Open - Compliant,North America
W_Case.106,W_User.11,W_Account.4,I have a question about my order.,I'm not certain that I received all the items in my order.  Can you please have a look for me?,Waiting on Customer,FALSE,2016-07-21 03:06:16,Waiting on Customer,Home Theatre,0,Email,Medium,Feature Request,Standard,Open - Compliant,North America
W_Case.107,W_User.8,W_Account.14,Need most recent invoice,I'm afraid I've lost my most recent invoice.  Would you mind sending it to me?  Thanks!,On Hold,FALSE,2016-03-30 07:39:52,On Hold,Consumer,0,Website,Low,Mail delivery issue,Standard,Open - Violation,Australia and New Zealand
W_Case.108,W_User.19,W_Account.26,How can I request a new feature?,"I have an idea for a new feature, and I'd like to share it with you.  What's the best way to do that?",Warning,FALSE,2016-12-31 08:01:52,Warning,Speakers,0,Chat,Critical,Software Issue,Standard,Open - Compliant,Asia
W_Case.109,W_User.11,W_Account.6,I need to pay my invoice.,It looks like I accidentally forgot to pay my invoice this month.  What's the quickest way to do this?,Escalated,TRUE,2016-01-30 01:46:37,Escalated,Speakers,0,Website,High,Existing problem,Premium,Open - Compliant,Australia and New Zealand
W_Case.110,W_User.2,W_Account.25,Was our last payment correct?,Our records indicate that we may have underpaid for our last order.  Can you please send a copy of our invoice?,New,FALSE,2016-10-16 20:04:27,New,Consumer,0,Mobile Device,High,Software Issue,Standard,Open - Compliant,Australia and New Zealand
W_Case.111,W_User.4,W_Account.5,Expediting my order?,"This month, I need my order expedited.  Are you able to do this?",Working,FALSE,2016-02-05 05:50:52,Working,Speakers,0,Twitter,High,Feature Request,Premium,Open - Compliant,Europe and the Middle East
W_Case.112,W_User.1,W_Account.11,How do I troubleshoot a product issue?,"I've been having a little trouble with your product, and I'm wondering if I can get some help figuring it out.",Working,FALSE,2016-05-21 07:20:41,Working,Enterprise,0,Email,Low,Existing problem,Standard,Open - Compliant,Asia
W_Case.113,W_User.8,W_Account.66,Setup Instructions are missing,I just received a package from you but it's missing installation instructions. Can you help me?,Closed in Community,TRUE,2016-01-16 13:34:18,Closed in Community,Projectors,78,Twitter,Low,New problem,Premium,Closed - Compliant,Europe and the Middle East
W_Case.114,W_User.18,W_Account.76,Purchase order question,"I was looking over my most recent bill, and there seems to be an extra line item.  Can you have a look at this for me?",Closed in Community,FALSE,2016-11-08 09:13:41,Closed in Community,Hotspot Services,97,Phone,Medium,Existing problem,Premium,Closed - Compliant,North America
W_Case.115,W_User.5,W_Account.75,How do I obtain your annual report?,"I'm researching successful companies, and I'm unable to find your annual report.  Can you guide me to the right place?",Escalated,FALSE,2016-11-24 12:12:38,Escalated,Headphones,0,Phone,High,Documentation Issue,Premium,Open - Compliant,Asia
W_Case.116,W_User.20,W_Account.20,"Product damaged, mishandled during shipping.","When my order arrived, the corner of the box was crushed, and the product had visible damage to it.  How would I return this to get a new one?",Working,TRUE,2016-01-03 18:48:07,Working,Speakers,0,Phone,Medium,Software Issue,Premium,Open - Compliant,North America
W_Case.117,W_User.10,W_Account.29,Please expedite my order.,What are my options for receiving my order more quickly?  Can I pay an expediting fee?,Working,FALSE,2016-11-16 11:04:12,Working,Consumer,0,Phone,Low,Software Issue,Premium,Open - Compliant,Europe and the Middle East
W_Case.118,W_User.4,W_Account.11,How do I check my order status?,"I ordered two days ago, and I just want to make sure that the order has been shipped and is on its way.  Thank you!",New,FALSE,2016-08-15 01:08:42,New,Hotspot Services,0,Mobile Device,Low,Mail delivery issue,Standard,Open - Violation,Australia and New Zealand
W_Case.119,W_User.8,W_Account.46,Billing statement reprint,I've managed to lose my most recent billing statement from you.  Would you mind sending me a reprint?  That would really help me out.  Thank you!,Attention,FALSE,2016-12-08 18:08:28,Attention,Headphones,0,Twitter,Medium,New problem,Premium,Open - Compliant,Asia
W_Case.120,W_User.16,W_Account.77,How much do I owe on my bill?,I can't find my last billing statement and am unsure how much my bill should be this month.,New,TRUE,2016-02-23 00:43:42,New,Headphones,0,Email,Low,Software Issue,Standard,Open - Compliant,Asia
W_Case.121,W_User.5,W_Account.73,I have a question about my contract.,Is there any sort of penalty for early renewal?  I can't seem to find anything about it.,New,FALSE,2016-03-17 16:41:39,New,Home Theatre,0,Chat,Critical,Problem Resolved,Standard,Open - Compliant,Asia
W_Case.122,W_User.13,W_Account.32,How do I set up auto-renewal?,I don't want to have to remember to renew my service each time.  How do I set this up so I don't have to?,Working,FALSE,2017-03-23 16:37:51,Working,Home Theatre,0,Website,Critical,Problem Resolved,Standard,Open - Compliant,Australia and New Zealand
W_Case.123,W_User.16,W_Account.50,Facebook Message from: Larry Baxter,"I've been a loyal customer for quite some time now, and I'd like to know if there's any program for recognizing and rewarding customers like me?",Closed,FALSE,2017-03-12 04:37:41,Closed,Conferencing,99,Website,Low,Hardware Issue,Standard,Closed - Compliant,Europe and the Middle East
W_Case.124,W_User.6,W_Account.51,Bill payment clarification.,"I seem to have misplaced my last bill, and I want to be sure that it's paid. Can you please check this for me?",Closed,FALSE,2016-02-17 13:14:33,Closed,Consumer,73,Website,Low,Feature Request,Premium,Closed - Compliant,Europe and the Middle East
W_Case.125,W_User.1,W_Account.60,What’s the product warranty policy?,"My product has been super reliable up until this point, but now it just won’t start.  I’ve tried everything to resolve the issue and no luck.  I’m trying to figure out whether it’s still under warranty.",Working,FALSE,2016-04-17 02:15:53,Working,Projectors,0,Website,Medium,New problem,Premium,Open - Compliant,24/7 Follow-The-Sun Service
W_Case.126,W_User.1,W_Account.2,I have a question about my contract.,Is there any sort of penalty for early renewal?  I can't seem to find anything about it.,Working,FALSE,2016-11-18 10:45:52,Working,Home Theatre,0,Phone,Low,Existing problem,Standard,Open - Compliant,Europe and the Middle East
W_Case.127,W_User.15,W_Account.62,Product manual is missing,I think I may have lost my user manual.  Can you please tell me where I can get a new one?,Response Received,FALSE,2016-05-30 01:48:17,Response Received,Projectors,0,Email,Low,Problem Resolved,Standard,Open - Compliant,Asia
W_Case.128,W_User.19,W_Account.58,Customer service hours of operation.,Can you please tell me when a customer service representative will be available to talk with me?  I have a complex issue that I think is best handled over the phone.  Thank you.,Response Received,TRUE,2016-09-14 02:57:48,Response Received,Speakers,0,Email,Low,Documentation Issue,Standard,Open - Violation,Australia and New Zealand
W_Case.129,W_User.2,W_Account.54,Question on my most recent order.,"I recently received my order, but the invoice had the wrong date on it  Can you please look into this for me?  Thank you!",Warning,FALSE,2016-09-14 12:53:05,Warning,Projectors,0,Mobile Device,Low,Existing problem,Standard,Open - Compliant,North America
W_Case.130,W_User.1,W_Account.23,Where do I submit a product suggestion?,I'd have an idea for an improvement to one of your products.  What's the best way for me to get this into your feature planning process?,Working,FALSE,2016-02-22 00:22:43,Working,Enterprise,0,Website,Low,Hardware Issue,Standard,Open - Compliant,North America
W_Case.131,W_User.9,W_Account.46,Does your app work on my mobile device?,"I have an older mobile phone, and I don't know if your app will run on it.  How would I find out?",Escalated,FALSE,2016-11-23 09:51:32,Escalated,Projectors,0,Twitter,Medium,Hardware Issue,Premium,Open - Compliant,24/7 Follow-The-Sun Service
W_Case.132,W_User.11,W_Account.43,Bill payment clarification.,"I seem to have misplaced my last bill, and I want to be sure that it's paid. Can you please check this for me?",Attention,TRUE,2016-05-20 03:22:02,Attention,Headphones,0,Phone,Low,Existing problem,Standard,Open - Compliant,North America
W_Case.133,W_User.17,W_Account.7,Need additional product information,I just became in charge of your product at my company. Can you send me some additional information on how it works?,Response Received,TRUE,2017-02-09 11:29:08,Response Received,Headphones,0,Community,Low,Feature Request,Standard,Open - Compliant,North America
W_Case.134,W_User.13,W_Account.68,How do I sign up for your email newsletter?,I'm interested in receiving your email newsletter.  How do I sign up for it?,Response Received,FALSE,2016-05-09 01:29:16,Response Received,Enterprise,0,Website,Medium,Hardware Issue,Standard,Open - Compliant,North America
W_Case.135,W_User.14,W_Account.47,How can I request a new feature?,"I have an idea for a new feature, and I'd like to share it with you.  What's the best way to do that?",Working,FALSE,2016-03-03 16:34:59,Working,Headphones,0,Google,Low,Hardware Issue,Standard,Open - Compliant,North America
W_Case.136,W_User.15,W_Account.76,Can you expedite my order?,I need to receive my order right away.  Is there a way you can expedite it?,Working,TRUE,2016-10-07 17:27:02,Working,Projectors,0,Email,Low,Feature Request,Standard,Open - Compliant,North America
W_Case.137,W_User.4,W_Account.42,How do I exchange a product?,"The product I ordered isn't quite right for me, but there's another that I think will do the job.  Is there a way I can exchange them?",Working,FALSE,2016-10-10 11:24:55,Working,Consumer,0,Chat,High,Hardware Issue,Premium,Open - Compliant,Australia and New Zealand
W_Case.138,W_User.16,W_Account.62,Can you expedite my order?,I need to receive my order right away.  Is there a way you can expedite it?,Working,FALSE,2016-11-28 20:59:58,Working,Headphones,0,Website,Low,Documentation Issue,Standard,Open - Compliant,Asia
W_Case.139,W_User.8,W_Account.50,Facebook Message from: Larry Baxter,"I've been a loyal customer for quite some time now, and I'd like to know if there's any program for recognizing and rewarding customers like me?",On Hold,TRUE,2017-03-09 04:22:40,On Hold,Enterprise,0,Email,Medium,Software Issue,Standard,Open - Compliant,North America
W_Case.140,W_User.13,W_Account.69,Where do I get your mobile app?,"I'd like to use your mobile app, but I'm not sure where to get it.  Can you point me in the right direction?",New,FALSE,2016-05-28 13:07:01,New,Enterprise,0,Email,Medium,Mail delivery issue,Standard,Open - Compliant,Asia
W_Case.141,W_User.18,W_Account.62,Setup Instructions are missing,I just received a package from you but it's missing installation instructions. Can you help me?,New,FALSE,2016-04-01 22:59:55,New,Home Theatre,0,Website,High,Feature Request,Standard,Open - Compliant,24/7 Follow-The-Sun Service
W_Case.142,W_User.5,W_Account.56,Billing statement incorrect,Customer's statement is incorrect - he has been billed twice for this month.,Closed,FALSE,2016-09-12 03:54:19,Closed,Speakers,90,Website,Low,New problem,Standard,Closed - Compliant,Australia and New Zealand
W_Case.143,W_User.2,W_Account.22,I have a question about my contract.,Is there any sort of penalty for early renewal?  I can't seem to find anything about it.,Escalated,FALSE,2016-07-04 14:11:24,Escalated,Speakers,0,Facebook,Low,Hardware Issue,Standard,Open - Compliant,Asia
W_Case.144,W_User.8,W_Account.71,How do I create a secure password?,I'd like to make sure my password is the strongest possible.  What are your password policies?,Working,FALSE,2016-07-29 17:09:09,Working,Conferencing,0,Website,Medium,Hardware Issue,Standard,Open - Compliant,24/7 Follow-The-Sun Service
W_Case.145,W_User.10,W_Account.51,How can I request a new feature?,"I have an idea for a new feature, and I'd like to share it with you.  What's the best way to do that?",New,FALSE,2016-05-11 06:48:41,New,Headphones,0,Email,Low,Software Issue,Standard,Open - Compliant,North America
W_Case.146,W_User.11,W_Account.27,Please expedite my order.,What are my options for receiving my order more quickly?  Can I pay an expediting fee?,Waiting on Customer,FALSE,2017-01-10 09:48:01,Waiting on Customer,Hotspot Services,0,Q&A,Low,Documentation Issue,Standard,Open - Compliant,Australia and New Zealand
W_Case.147,W_User.17,W_Account.67,Troubleshooting issues with the product,I think the product I have is malfunctioning. Do I need an update or upgrade? What should I do?,Working,FALSE,2017-03-04 01:40:51,Working,Enterprise,0,Phone,Low,New problem,Standard,Open - Compliant,Asia
W_Case.148,W_User.19,W_Account.68,What does your service contract cover?,I'm deciding if I need a service contract for your products.  Where can I find out what's covered and what's not?,Working,TRUE,2016-10-04 09:36:10,Working,Consumer,0,Instagram,Low,New problem,Standard,Open - Compliant,Europe and the Middle East
W_Case.149,W_User.19,W_Account.42,Billing statement incorrect,Customer's statement is incorrect - he has been billed twice for this month.,Working,FALSE,2016-11-21 21:58:52,Working,Projectors,0,Website,Low,Existing problem,Standard,Open - Compliant,Asia
W_Case.150,W_User.2,W_Account.45,I have a question about my contract.,Is there any sort of penalty for early renewal?  I can't seem to find anything about it.,New,FALSE,2016-06-21 00:25:30,New,Consumer,0,Mobile Device,Low,New problem,Standard,Open - Compliant,North America
W_Case.151,W_User.5,W_Account.76,Billing address change,Customer has changed locations and would like to update their billing address.,Closed,TRUE,2017-02-15 15:30:24,Closed,Projectors,85,Website,Medium,Software Issue,Standard,Closed - Compliant,24/7 Follow-The-Sun Service
W_Case.152,W_User.20,W_Account.73,Setup Instructions are missing,I just received a package from you but it's missing installation instructions. Can you help me?,Working,FALSE,2016-01-22 16:11:23,Working,Conferencing,0,Phone,High,Problem Resolved,Premium,Open - Violation,Asia
W_Case.153,W_User.20,W_Account.12,Where do I send my check?,I'd like to send you a check for my most recent invoice.  To which address should I send it?,Closed,FALSE,2016-09-25 17:52:32,Closed,Conferencing,71,Email,Low,Hardware Issue,Standard,Closed - Compliant,Europe and the Middle East
W_Case.154,W_User.7,W_Account.44,Can you expedite my order?,I need to receive my order right away.  Is there a way you can expedite it?,Waiting on Customer,FALSE,2017-03-12 19:26:10,Waiting on Customer,Conferencing,0,Twitter,Medium,Documentation Issue,Standard,Open - Compliant,24/7 Follow-The-Sun Service
W_Case.155,W_User.9,W_Account.20,Question about my last billing statement,I can't figure out my balance on my last billing statement.  I can't seem to make it match anything.  Can you help me figure it out?,Waiting on Customer,FALSE,2016-04-18 17:39:49,Waiting on Customer,Headphones,0,Mobile Device,Medium,Mail delivery issue,Standard,Open - Compliant,North America
W_Case.156,W_User.13,W_Account.43,Can you help me get set up?,"I've just become a customer, and I'd like to get set up.  Can you please walk me through the steps necessary to do this?",Working,FALSE,2016-02-04 04:46:55,Working,Enterprise,0,Email,Medium,Mail delivery issue,Premium,Open - Compliant,North America
W_Case.157,W_User.18,W_Account.26,Projector lamp replacement,how to?,Working,FALSE,2016-08-07 22:44:25,Working,Headphones,0,Instagram,Medium,Existing problem,Premium,Open - Violation,Australia and New Zealand
W_Case.158,W_User.5,W_Account.43,I need to pay my invoice.,It seems I have an invoice that's overdue.  What's the best way to go about paying this quickly?,On Hold,FALSE,2016-09-06 17:05:52,On Hold,Consumer,0,Community,Low,Existing problem,Premium,Open - Compliant,Asia
W_Case.159,W_User.1,W_Account.15,Where can I download your mobile app?,"I'd like to use your app on my mobile phone, but I can't seem to figure out where to download it.  Can you point me in the right direction?",New,FALSE,2016-09-22 01:00:01,New,Hotspot Services,0,Phone,Low,Software Issue,Standard,Open - Compliant,North America
W_Case.160,W_User.4,W_Account.6,How do I change my password?,I'd like to change my password to make it more secure.  Where do I do this?,Closed,FALSE,2016-05-18 18:12:49,Closed,Conferencing,66,Community,Low,New problem,Premium,Closed - Compliant,Europe and the Middle East
W_Case.161,W_User.3,W_Account.67,How do I get started with your service?,"Now that I've signed up, what do I do next?",New,TRUE,2017-03-01 21:49:47,New,Speakers,0,Phone,High,New problem,Standard,Open - Compliant,Europe and the Middle East
W_Case.162,W_User.17,W_Account.14,Projector lamp replacement,how to?,Working,FALSE,2016-03-01 09:08:49,Working,Home Theatre,0,Community,Low,Mail delivery issue,Standard,Open - Compliant,Australia and New Zealand
W_Case.163,W_User.8,W_Account.24,Facebook Message from: Larry Baxter,"I've been a loyal customer for quite some time now, and I'd like to know if there's any program for recognizing and rewarding customers like me?",Working,FALSE,2016-12-23 06:17:59,Working,Conferencing,0,Q&A,Low,Problem Resolved,Standard,Open - Compliant,24/7 Follow-The-Sun Service
W_Case.164,W_User.18,W_Account.43,Problem with my bill,I've been billed twice this month.  Please resolve ASAP.,Closed,FALSE,2016-05-23 15:56:50,Closed,Headphones,89,Q&A,Low,Existing problem,Standard,Closed - Compliant,Europe and the Middle East
W_Case.165,W_User.16,W_Account.64,How do I upgrade?,"I've been a happy customer of yours for more than a year, and I'd like to upgrade.  What's the best way to do this?",New,FALSE,2016-04-27 19:16:21,New,Headphones,0,Website,Low,Existing problem,Standard,Open - Compliant,Asia
W_Case.166,W_User.2,W_Account.25,I have a product suggestion.,"I've been using your products for a long time, and I have a suggestion that I think would make them even better.  What's the best way to share this with you?",Working,FALSE,2016-05-15 03:21:07,Working,Home Theatre,0,Phone,Critical,New problem,Standard,Open - Compliant,Australia and New Zealand
W_Case.167,W_User.20,W_Account.33,Billing address change,Customer has changed locations and would like to update their billing address.,Closed in Community,FALSE,2016-03-25 14:12:07,Closed in Community,Projectors,81,Phone,Low,Mail delivery issue,Standard,Closed - Compliant,24/7 Follow-The-Sun Service
W_Case.168,W_User.4,W_Account.20,"Product damaged, mishandled during shipping.","When my order arrived, the corner of the box was crushed, and the product had visible damage to it.  How would I return this to get a new one?",On Hold,FALSE,2016-04-09 13:39:59,On Hold,Conferencing,0,Phone,Low,Documentation Issue,Standard,Open - Compliant,North America
W_Case.169,W_User.3,W_Account.45,Is my personal information safe?,"I've been hearing a lot about data security recently, and I'd just like to make sure that your company is keeping my personal information safe.",New,FALSE,2016-03-03 14:49:59,New,Speakers,0,Phone,Medium,New problem,Standard,Open - Compliant,Australia and New Zealand
W_Case.170,W_User.5,W_Account.45,Setup Instructions are missing,I just received a package from you but it's missing installation instructions. Can you help me?,Working,FALSE,2016-12-11 04:08:38,Working,Conferencing,0,LinkedIn,Low,Mail delivery issue,Standard,Open - Violation,24/7 Follow-The-Sun Service
W_Case.171,W_User.8,W_Account.5,How do I diagnose this product issue?,"I tried to figure it out on my own, but I can't seem to.  Can you help me?",Closed,FALSE,2016-11-11 19:40:13,Closed,Conferencing,57,Email,Medium,Existing problem,Premium,Closed - Compliant,Australia and New Zealand
