External_Id__c,Owner.External_Id__c,Account.External_Id__c,Subject,Description,Status_Options,First_Contact_Close__c,CreatedDate__c,Status,Product_Family_KB__c,CSAT__c,Origin,Priority,Reason,Type_of_Support__c,Milestone_Status__c,BusinessHours.Name
W_Case.172,W_User.5,W_Account.12,Shipping container appears damaged,"When your product arrived, the box was damaged, and I'm not certain if your product is working properly.  What's the return process?",Working,FALSE,2016-05-03 11:37:36,Working,Headphones,0,Email,Critical,Existing problem,Standard,Open - Compliant,Europe and the Middle East
W_Case.173,W_User.16,W_Account.46,Initiating return process.,Customer is having issues with the product and would like to initiate a return.,New,FALSE,2016-04-13 01:45:15,New,Home Theatre,0,Email,Low,New problem,Standard,Open - Compliant,Australia and New Zealand
W_Case.174,W_User.5,W_Account.61,I need to pay my invoice.,It looks like I accidentally forgot to pay my invoice this month.  What's the quickest way to do this?,Closed,FALSE,2017-01-10 07:31:36,Closed,Projectors,86,Chat,Low,Feature Request,Standard,Closed - Compliant,24/7 Follow-The-Sun Service
W_Case.175,W_User.9,W_Account.65,Error on my bill,It appears that I was charged twice this month on my bill.  Can you help?,Waiting on Customer,FALSE,2016-01-08 16:39:32,Waiting on Customer,Consumer,0,Mobile Device,Low,Documentation Issue,Standard,Open - Violation,Asia
W_Case.176,W_User.15,W_Account.48,Question about taxes on my order.,"Can you help me calculate the taxes on my order?  Because of my location, I'm not sure what they should be.",Working,FALSE,2017-02-15 04:43:42,Working,Hotspot Services,0,Chat,Low,Hardware Issue,Standard,Open - Compliant,Asia
W_Case.177,W_User.17,W_Account.52,I have a question about my order.,I'm not certain that I received all the items in my order.  Can you please have a look for me?,New,FALSE,2016-09-12 11:05:18,New,Consumer,0,Twitter,Low,New problem,Standard,Open - Compliant,North America
W_Case.178,W_User.5,W_Account.23,Where do I submit a product suggestion?,I'd have an idea for an improvement to one of your products.  What's the best way for me to get this into your feature planning process?,New,FALSE,2017-03-29 09:02:13,New,Hotspot Services,0,Twitter,Low,Feature Request,Standard,Open - Compliant,24/7 Follow-The-Sun Service
W_Case.179,W_User.6,W_Account.6,How do I set up auto-renewal?,"I'd like to set up auto-renewal on my account, but I can't figure out how to do it.  Can you help me?",Closed,FALSE,2016-05-29 22:31:05,Closed,Consumer,58,Website,Low,Hardware Issue,Standard,Closed - Compliant,Asia
W_Case.180,W_User.5,W_Account.6,What's included in your service contract?,Do I need a service contract? Where can I find out what's covered and what's not?,Waiting on Customer,FALSE,2016-08-01 06:02:00,Waiting on Customer,Enterprise,0,Community,High,Existing problem,Premium,Open - Compliant,Europe and the Middle East
W_Case.181,W_User.15,W_Account.38,How do I exchange a product?,"The product I ordered isn't quite right for me, but there's another that I think will do the job.  Is there a way I can exchange them?",New,FALSE,2016-02-14 16:57:40,New,Conferencing,0,Twitter,High,New problem,Standard,Open - Violation,North America
W_Case.182,W_User.19,W_Account.57,Question about my invoice,There appears to be an error on my invoice. Can you help me correct it so I can get it paid?,Warning,FALSE,2016-11-19 12:38:54,Warning,Headphones,0,Website,Low,Software Issue,Premium,Open - Compliant,Europe and the Middle East
W_Case.183,W_User.10,W_Account.77,Question about taxes on my order.,"Can you help me calculate the taxes on my order?  Because of my location, I'm not sure what they should be.",Working,FALSE,2016-01-18 01:28:49,Working,Consumer,0,Phone,Low,Documentation Issue,Standard,Open - Violation,Australia and New Zealand
W_Case.184,W_User.8,W_Account.49,Where do I send my check?,I'd like to send you a check for my most recent invoice.  To which address should I send it?,New,TRUE,2016-11-09 19:33:29,New,Home Theatre,0,Email,Critical,Existing problem,Standard,Open - Compliant,North America
W_Case.185,W_User.7,W_Account.51,How do I obtain your annual report?,"I'm researching successful companies, and I'm unable to find your annual report.  Can you guide me to the right place?",New,FALSE,2016-10-25 07:13:12,New,Consumer,0,Chat,Medium,Software Issue,Standard,Open - Compliant,24/7 Follow-The-Sun Service
W_Case.186,W_User.1,W_Account.31,How do I change my communication preferences?,I'd like to switch from regular mail to email.  How do I do this?,Working,FALSE,2016-09-22 08:10:37,Working,Conferencing,0,Mobile Device,Low,Software Issue,Premium,Open - Compliant,24/7 Follow-The-Sun Service
W_Case.187,W_User.14,W_Account.42,How do I create a secure password?,I'd like to make sure my password is the strongest possible.  What are your password policies?,New,FALSE,2017-03-20 14:45:59,New,Home Theatre,0,Website,Medium,New problem,Standard,Open - Compliant,Europe and the Middle East
W_Case.188,W_User.10,W_Account.7,How do I upgrade my service?,I really like your service and I'd like to get the upgraded service.  How do I go about doing this?,Warning,FALSE,2016-05-21 06:05:41,Warning,Consumer,0,Mobile Device,Critical,Mail delivery issue,Premium,Open - Compliant,Asia
W_Case.189,W_User.17,W_Account.30,Do you sell replacement parts?,"While disassembling the unit, I dropped one of the parts and broke it.  How would I order a replacement part?",On Hold,FALSE,2016-03-16 15:21:54,On Hold,Conferencing,0,Email,High,New problem,Standard,Open - Compliant,Europe and the Middle East
W_Case.190,W_User.3,W_Account.36,I can't understand the installation instructions,"I've just purchased your product, but I'm having trouble understanding the installation instructions. Can you help me get started?",Working,FALSE,2016-02-09 16:24:27,Working,Headphones,0,Mobile Device,High,Hardware Issue,Standard,Open - Compliant,Europe and the Middle East
W_Case.191,W_User.7,W_Account.75,Where can I download your mobile app?,"I'd like to use your app on my mobile phone, but I can't seem to figure out where to download it.  Can you point me in the right direction?",Response Received,FALSE,2016-12-03 08:48:34,Response Received,Enterprise,0,Phone,Low,Existing problem,Standard,Open - Compliant,Asia
W_Case.192,W_User.5,W_Account.65,Bill payment clarification.,"I seem to have misplaced my last bill, and I want to be sure that it's paid. Can you please check this for me?",Closed in Community,FALSE,2017-01-31 05:31:31,Closed in Community,Hotspot Services,98,Google,Medium,Problem Resolved,Standard,Closed - Compliant,Europe and the Middle East
W_Case.193,W_User.17,W_Account.12,How do I troubleshoot a product issue?,"I've been having a little trouble with your product, and I'm wondering if I can get some help figuring it out.",New,FALSE,2016-07-27 18:07:12,New,Home Theatre,0,Phone,Low,Existing problem,Standard,Open - Compliant,North America
W_Case.194,W_User.4,W_Account.39,How do I check my order status?,"I ordered two days ago, and I just want to make sure that the order has been shipped and is on its way.  Thank you!",New,FALSE,2016-06-12 10:31:22,New,Headphones,0,Email,Low,Problem Resolved,Standard,Open - Compliant,Asia
W_Case.195,W_User.7,W_Account.12,Does your app work on my mobile device?,"I have an older mobile phone, and I don't know if your app will run on it.  How would I find out?",On Hold,FALSE,2016-02-17 19:56:46,On Hold,Conferencing,0,Email,Low,Problem Resolved,Standard,Open - Compliant,Asia
W_Case.196,W_User.10,W_Account.8,How do I diagnose this product issue?,"I tried to figure it out on my own, but I can't seem to.  Can you help me?",Working,FALSE,2016-02-08 15:39:00,Working,Conferencing,0,Twitter,Medium,Documentation Issue,Standard,Open - Compliant,24/7 Follow-The-Sun Service
W_Case.197,W_User.3,W_Account.17,What does your service contract cover?,I'm deciding if I need a service contract for your products.  Where can I find out what's covered and what's not?,Escalated,TRUE,2017-03-17 11:41:19,Escalated,Headphones,0,Website,Low,New problem,Standard,Open - Compliant,North America
W_Case.198,W_User.19,W_Account.9,How is my password stored?,"I've been hearing a lot about data security recently, and I'd just like to make sure that your company is keeping my personal information safe.",Working,FALSE,2017-01-13 02:51:05,Working,Conferencing,0,Email,High,Hardware Issue,Standard,Open - Compliant,Australia and New Zealand
W_Case.199,W_User.11,W_Account.71,Please send shipping confirmation.,"I placed an order last week, but still haven't received a shipping confirmation.  Can you please sent it to me?",Working,TRUE,2016-08-02 22:11:31,Working,Speakers,0,Email,Low,Mail delivery issue,Standard,Open - Compliant,North America
W_Case.200,W_User.1,W_Account.55,Can you expedite my order?,I need to receive my order right away.  Is there a way you can expedite it?,Closed,FALSE,2016-08-14 16:01:03,Closed,Enterprise,82,Facebook,Medium,Problem Resolved,Standard,Closed - Compliant,North America
W_Case.201,W_User.11,W_Account.33,I need to pay my invoice.,It seems I have an invoice that's overdue.  What's the best way to go about paying this quickly?,Working,FALSE,2017-01-30 04:45:12,Working,Consumer,0,Email,Medium,Problem Resolved,Standard,Open - Compliant,Europe and the Middle East
W_Case.202,W_User.12,W_Account.69,Billing issue,There's a problem with my bill - I have two statements for this month.  Please help!,Closed,TRUE,2016-01-17 17:48:55,Closed,Projectors,52,Twitter,Low,Feature Request,Premium,Closed - Compliant,24/7 Follow-The-Sun Service
W_Case.203,W_User.10,W_Account.17,Please send shipping confirmation.,"I placed an order last week, but still haven't received a shipping confirmation.  Can you please sent it to me?",Closed,FALSE,2016-04-14 13:17:14,Closed,Headphones,71,Email,Medium,Problem Resolved,Standard,Closed - Compliant,Australia and New Zealand
W_Case.204,W_User.6,W_Account.56,How do I get started with your service?,"Now that I've signed up, what do I do next?",Closed,TRUE,2016-10-15 17:23:35,Closed,Enterprise,83,Email,Low,Mail delivery issue,Standard,Closed - Compliant,24/7 Follow-The-Sun Service
W_Case.205,W_User.10,W_Account.24,Where can I purchase your products?,"I've done my research, and I'm ready to buy.  Where can I purchase your products in my region?",Working,FALSE,2016-09-12 22:03:51,Working,Enterprise,0,Mobile Device,Low,Hardware Issue,Standard,Open - Compliant,Europe and the Middle East
W_Case.206,W_User.10,W_Account.63,Where do I get your mobile app?,"I'd like to use your mobile app, but I'm not sure where to get it.  Can you point me in the right direction?",New,FALSE,2016-06-26 10:10:42,New,Enterprise,0,Mobile Device,Low,Existing problem,Standard,Open - Compliant,24/7 Follow-The-Sun Service
W_Case.207,W_User.5,W_Account.31,How do I diagnose this product issue?,"I tried to figure it out on my own, but I can't seem to.  Can you help me?",Working,FALSE,2016-04-15 04:08:14,Working,Enterprise,0,Phone,Low,Documentation Issue,Standard,Open - Compliant,Australia and New Zealand
W_Case.208,W_User.12,W_Account.19,How do I check my order status?,"I ordered two days ago, and I just want to make sure that the order has been shipped and is on its way.  Thank you!",Working,FALSE,2016-04-22 22:35:50,Working,Projectors,0,Phone,High,Existing problem,Premium,Open - Compliant,Australia and New Zealand
W_Case.209,W_User.1,W_Account.25,How do I sign up for your email newsletter?,I'm interested in receiving your email newsletter.  How do I sign up for it?,Response Received,TRUE,2016-12-19 09:19:17,Response Received,Projectors,0,Facebook,Low,Existing problem,Standard,Open - Compliant,Asia
W_Case.210,W_User.7,W_Account.65,How do I change my communication preferences?,I'd like to switch from regular mail to email.  How do I do this?,Closed,FALSE,2016-08-18 17:27:00,Closed,Conferencing,59,Phone,Low,Existing problem,Standard,Closed - Compliant,Europe and the Middle East
W_Case.211,W_User.12,W_Account.13,I need to pay my invoice.,It looks like I accidentally forgot to pay my invoice this month.  What's the quickest way to do this?,Attention,FALSE,2016-01-14 05:54:42,Attention,Speakers,0,Website,Low,Hardware Issue,Premium,Open - Compliant,North America
W_Case.212,W_User.8,W_Account.31,How do I obtain your annual report?,"I'm researching successful companies, and I'm unable to find your annual report.  Can you guide me to the right place?",Response Received,FALSE,2016-08-04 02:22:19,Response Received,Projectors,0,Phone,High,Software Issue,Standard,Open - Compliant,Asia
W_Case.213,W_User.8,W_Account.71,Facebook Message from: Lauren Boyle,Where I can find out more about the new product line you just announced?  I'm excited to know more details.,Closed in Community,FALSE,2017-03-30 16:48:32,Closed in Community,Headphones,63,Website,Low,Documentation Issue,Standard,Closed - Compliant,24/7 Follow-The-Sun Service
W_Case.214,W_User.16,W_Account.21,Where can I purchase your products?,"I've done my research, and I'm ready to buy.  Where can I purchase your products in my region?",New,FALSE,2016-01-31 03:41:04,New,Projectors,0,Email,Medium,Mail delivery issue,Premium,Open - Compliant,Australia and New Zealand
W_Case.215,W_User.18,W_Account.35,Need guidance getting started with my installation,I need some help getting started with this installation.,New,FALSE,2017-01-25 12:43:24,New,Consumer,0,Email,Low,Existing problem,Premium,Open - Violation,Australia and New Zealand
W_Case.216,W_User.19,W_Account.22,Bill payment clarification.,"I seem to have misplaced my last bill, and I want to be sure that it's paid. Can you please check this for me?",Working,TRUE,2016-09-06 01:17:40,Working,Enterprise,0,Email,Medium,Mail delivery issue,Premium,Open - Compliant,North America
W_Case.217,W_User.10,W_Account.11,Troubleshooting issues with the product,I think the product I have is malfunctioning. Do I need an update or upgrade? What should I do?,Escalated,FALSE,2017-01-11 16:04:36,Escalated,Enterprise,0,Email,Low,Problem Resolved,Standard,Open - Violation,North America
W_Case.218,W_User.17,W_Account.24,Can you help me get set up?,"I've just become a customer, and I'd like to get set up.  Can you please walk me through the steps necessary to do this?",Waiting on Customer,FALSE,2016-08-02 04:17:17,Waiting on Customer,Consumer,0,Website,Low,New problem,Standard,Open - Compliant,North America
W_Case.219,W_User.14,W_Account.14,Question on my most recent order.,"I recently received my order, but the invoice had the wrong date on it  Can you please look into this for me?  Thank you!",Escalated,FALSE,2016-01-11 13:38:09,Escalated,Speakers,0,Email,High,Feature Request,Premium,Open - Compliant,Asia
W_Case.220,W_User.18,W_Account.30,Billing issue,There's a problem with my bill - I have two statements for this month.  Please help!,Closed,FALSE,2017-01-29 23:22:00,Closed,Projectors,99,Website,Medium,Feature Request,Standard,Closed - Compliant,Asia
W_Case.221,W_User.2,W_Account.73,I have a product suggestion.,"As a user of your products, I have an idea that I think would your products more flexible would show tremendous value.",Working,FALSE,2016-02-18 12:30:37,Working,Speakers,0,Twitter,Low,Documentation Issue,Standard,Open - Compliant,Asia
W_Case.222,W_User.9,W_Account.71,Customer called to make a payment,Customer called in to make a payment on their account and had a question about updating their mailing address.,Working,FALSE,2016-09-10 04:45:43,Working,Projectors,0,Chat,Medium,Feature Request,Standard,Open - Violation,North America
W_Case.223,W_User.11,W_Account.74,Can you help me get set up?,"I've just become a customer, and I'd like to get set up.  Can you please walk me through the steps necessary to do this?",Attention,FALSE,2016-05-25 13:50:26,Attention,Projectors,0,Mobile Device,Low,Problem Resolved,Standard,Open - Compliant,North America
W_Case.224,W_User.3,W_Account.36,I received the wrong invoice.,I received a different customer's invoice.  Would you mind sending me mine so I can pay it?,New,TRUE,2016-12-31 20:38:25,New,Projectors,0,Phone,Low,Software Issue,Standard,Open - Compliant,Australia and New Zealand
W_Case.225,W_User.14,W_Account.68,Need additional product information,I just became in charge of your product at my company. Can you send me some additional information on how it works?,New,FALSE,2016-01-16 08:39:13,New,Speakers,0,Phone,Low,Problem Resolved,Premium,Open - Compliant,Asia
W_Case.226,W_User.17,W_Account.55,Question about taxes on my order.,"Can you help me calculate the taxes on my order?  Because of my location, I'm not sure what they should be.",Working,TRUE,2016-01-08 11:05:42,Working,Projectors,0,Phone,Medium,Problem Resolved,Standard,Open - Compliant,Europe and the Middle East
W_Case.227,W_User.7,W_Account.48,Customer lost product manual and needs replacement,Customer has misplaced the product manual and would like a replacement.,Working,TRUE,2016-09-29 09:54:18,Working,Hotspot Services,0,Chat,Low,Software Issue,Premium,Open - Compliant,Australia and New Zealand
W_Case.228,W_User.6,W_Account.61,How do I upgrade my service?,I really like your service and I'd like to get the upgraded service.  How do I go about doing this?,Working,FALSE,2016-12-15 14:41:28,Working,Hotspot Services,0,Chat,High,New problem,Premium,Open - Compliant,Europe and the Middle East
W_Case.229,W_User.2,W_Account.30,Problem with my bill,I've been billed twice this month.  Please resolve ASAP.,New,FALSE,2016-07-04 12:50:48,New,Conferencing,0,Mobile Device,Low,Documentation Issue,Standard,Open - Compliant,Asia
W_Case.230,W_User.4,W_Account.8,I have a product suggestion.,"I've been using your products for a long time, and I have a suggestion that I think would make them even better.  What's the best way to share this with you?",Closed,TRUE,2016-12-23 19:19:33,Closed,Hotspot Services,67,Community,Low,Problem Resolved,Standard,Closed - Compliant,Europe and the Middle East
W_Case.231,W_User.12,W_Account.62,I have a question about my contract.,Is there any sort of penalty for early renewal?  I can't seem to find anything about it.,New,FALSE,2017-03-05 04:35:49,New,Consumer,0,Twitter,Medium,Software Issue,Standard,Open - Compliant,Australia and New Zealand
W_Case.232,W_User.6,W_Account.65,Where do I send my check?,I'd like to send you a check for my most recent invoice.  To which address should I send it?,Working,FALSE,2016-11-24 01:54:42,Working,Speakers,0,Mobile Device,Low,Hardware Issue,Standard,Open - Compliant,Europe and the Middle East
W_Case.233,W_User.6,W_Account.1,Items missing from shipment.,"Our shipment arrived, but there are several items missing.  Would you mind confirming if they were on the invoice?",Closed,FALSE,2016-09-17 13:23:04,Closed,Conferencing,66,Twitter,Medium,Problem Resolved,Premium,Closed - Compliant,Australia and New Zealand
W_Case.234,W_User.13,W_Account.75,How do I set up auto-renewal?,I don't want to have to remember to renew my service each time.  How do I set this up so I don't have to?,New,TRUE,2016-06-01 17:01:50,New,Speakers,0,Email,Medium,Problem Resolved,Premium,Open - Compliant,North America
W_Case.235,W_User.5,W_Account.1,Where do I get your mobile app?,"I'd like to use your mobile app, but I'm not sure where to get it.  Can you point me in the right direction?",New,FALSE,2016-02-10 01:53:12,New,Headphones,0,Website,Low,Existing problem,Standard,Open - Compliant,24/7 Follow-The-Sun Service
W_Case.236,W_User.12,W_Account.67,How do I obtain your annual report?,"I'm researching successful companies, and I'm unable to find your annual report.  Can you guide me to the right place?",Waiting on Customer,FALSE,2016-06-08 03:16:59,Waiting on Customer,Conferencing,0,Q&A,Low,Existing problem,Standard,Open - Compliant,Europe and the Middle East
W_Case.237,W_User.4,W_Account.37,Question about my last billing statement,I can't figure out my balance on my last billing statement.  I can't seem to make it match anything.  Can you help me figure it out?,Escalated,FALSE,2016-08-11 00:41:26,Escalated,Hotspot Services,0,Website,Low,New problem,Standard,Open - Compliant,Europe and the Middle East
W_Case.238,W_User.1,W_Account.41,Question about my invoice,There appears to be an error on my invoice. Can you help me correct it so I can get it paid?,Closed in Community,FALSE,2016-10-03 04:27:39,Closed in Community,Consumer,69,Facebook,Medium,New problem,Standard,Closed - Compliant,Asia
W_Case.239,W_User.3,W_Account.68,Please expedite my order.,What are my options for receiving my order more quickly?  Can I pay an expediting fee?,Working,FALSE,2016-10-06 14:50:10,Working,Conferencing,0,Website,Low,Existing problem,Premium,Open - Compliant,Europe and the Middle East
W_Case.240,W_User.9,W_Account.12,How can I request a new feature?,"I have an idea for a new feature, and I'd like to share it with you.  What's the best way to do that?",Working,FALSE,2016-12-01 15:38:02,Working,Conferencing,0,Mobile Device,Low,Problem Resolved,Standard,Open - Violation,24/7 Follow-The-Sun Service
W_Case.241,W_User.14,W_Account.7,Incorrect bill,By bill is displaying incorrect information.  I was billed double last month.  Please help with this stat!,Working,FALSE,2016-10-01 23:05:04,Working,Headphones,0,Mobile Device,Medium,Problem Resolved,Standard,Open - Compliant,Asia
W_Case.242,W_User.6,W_Account.46,I have a question about my contract.,Is there any sort of penalty for early renewal?  I can't seem to find anything about it.,Attention,FALSE,2016-06-10 07:41:27,Attention,Speakers,0,Mobile Device,Medium,Mail delivery issue,Standard,Open - Compliant,Europe and the Middle East
W_Case.243,W_User.9,W_Account.76,Setup Instructions are missing,I just received a package from you but it's missing installation instructions. Can you help me?,Working,FALSE,2017-01-07 18:49:04,Working,Hotspot Services,0,Community,Low,New problem,Standard,Open - Compliant,Europe and the Middle East
W_Case.244,W_User.19,W_Account.7,Where can I purchase your products?,"I've done my research, and I'm ready to buy.  Where can I purchase your products in my region?",Closed,FALSE,2016-12-22 13:48:49,Closed,Projectors,52,Q&A,Low,Feature Request,Premium,Closed - Compliant,Australia and New Zealand
W_Case.245,W_User.6,W_Account.11,Is my personal information safe?,"I've been hearing a lot about data security recently, and I'd just like to make sure that your company is keeping my personal information safe.",New,FALSE,2016-10-25 14:45:20,New,Home Theatre,0,Website,Medium,New problem,Standard,Open - Compliant,Australia and New Zealand
W_Case.246,W_User.14,W_Account.45,Customer would like to upgrade,"The customer is happy with our service and is interested in upgrading, but needs help.",Closed,FALSE,2017-03-06 05:08:21,Closed,Conferencing,67,Mobile Device,Low,Hardware Issue,Standard,Closed - Violation,24/7 Follow-The-Sun Service
W_Case.247,W_User.1,W_Account.9,Question about my invoice,There appears to be an error on my invoice. Can you help me correct it so I can get it paid?,Waiting on Customer,TRUE,2016-12-09 13:04:48,Waiting on Customer,Headphones,0,LinkedIn,Low,Existing problem,Standard,Open - Compliant,North America
W_Case.248,W_User.16,W_Account.39,How do I create a secure password?,I'd like to make sure my password is the strongest possible.  What are your password policies?,Working,FALSE,2017-03-23 17:13:02,Working,Hotspot Services,0,Website,Low,Mail delivery issue,Standard,Open - Violation,Australia and New Zealand
W_Case.249,W_User.19,W_Account.52,Please send shipping confirmation.,"I placed an order last week, but still haven't received a shipping confirmation.  Can you please sent it to me?",Working,FALSE,2016-07-20 14:05:23,Working,Projectors,0,Email,Low,Software Issue,Standard,Open - Compliant,24/7 Follow-The-Sun Service
W_Case.250,W_User.2,W_Account.54,Error on my bill,It appears that I was charged twice this month on my bill.  Can you help?,New,FALSE,2016-06-18 10:57:33,New,Hotspot Services,0,Website,Low,Mail delivery issue,Standard,Open - Compliant,Europe and the Middle East
W_Case.251,W_User.13,W_Account.44,Customer would like to upgrade,"The customer is happy with our service and is interested in upgrading, but needs help.",New,FALSE,2016-02-23 10:11:29,New,Speakers,0,Phone,Low,Problem Resolved,Premium,Open - Compliant,Australia and New Zealand
W_Case.252,W_User.4,W_Account.46,Can I use your app on my phone?,"I just got a new mobile phone, and I'm wondering if I can run your mobile app on it.",New,FALSE,2016-06-01 11:03:43,New,Conferencing,0,Community,Medium,Existing problem,Standard,Open - Compliant,24/7 Follow-The-Sun Service
W_Case.253,W_User.10,W_Account.30,How do I change my password?,I'd like to change my password to make it more secure.  Where do I do this?,Working,FALSE,2016-12-15 18:11:31,Working,Consumer,0,Community,Medium,Mail delivery issue,Standard,Open - Compliant,North America
W_Case.254,W_User.13,W_Account.76,I need to pay my invoice.,It seems I have an invoice that's overdue.  What's the best way to go about paying this quickly?,New,FALSE,2016-02-12 10:48:30,New,Home Theatre,0,Instagram,High,Mail delivery issue,Standard,Open - Compliant,Australia and New Zealand
W_Case.255,W_User.3,W_Account.57,Question about taxes on my order.,"Can you help me calculate the taxes on my order?  Because of my location, I'm not sure what they should be.",Working,FALSE,2016-03-24 12:39:36,Working,Projectors,0,Email,Low,Hardware Issue,Standard,Open - Compliant,North America
W_Case.256,W_User.8,W_Account.13,Assembly instruction help,Need some help with the assembly instructions,New,FALSE,2016-12-22 11:22:22,New,Speakers,0,Phone,Low,Mail delivery issue,Standard,Open - Compliant,North America
W_Case.257,W_User.2,W_Account.21,Billing issue,There's a problem with my bill - I have two statements for this month.  Please help!,Closed,FALSE,2016-04-20 20:09:15,Closed,Home Theatre,74,Google,Medium,Mail delivery issue,Standard,Closed - Compliant,Asia
